H1: IS | I1: Input Shaft | J1: :IS | K1: Input Side
H2: ID | I2: Idler Shaft | J2: :OS | K2: Ouput Side
B3: Part | H3: OS | I3: Output Shaft
B4: Gear | F4: Bearing | L4: Shaft
A5: Case | B5: 32T | C5: 96T | D5: 48T | E5: 80T | F5: IS:IS | G5: ID:IS | H5: OS:IS | I5: IS:OS | J5: ID:OS | K5: OS:OS | L5: Input | M5: Output
A6: Spur 1 | B6: Good | C6: Good | D6: Good | E6: Good | F6: Good | G6: Good | H6: Good | I6: Good | J6: Good | K6: Good | L6: Good | M6: Good
A7: Spur 2 | B7: Chipped | C7: Good | D7: Eccentric | E7: Good | F7: Good | G7: Good | H7: Good | I7: Good | J7: Good | K7: Good | L7: Good | M7: Good
A8: Spur 3 | B8: Good | C8: Good | D8: Eccentric | E8: Good | F8: Good | G8: Good | H8: Good | I8: Good | J8: Good | K8: Good | L8: Good | M8: Good
A9: Spur 4 | B9: Good | C9: Good | D9: Eccentric | E9: Broken | F9: Ball | G9: Good | H9: Good | I9: Good | J9: Good | K9: Good | L9: Good | M9: Good
A10: Spur 5 | B10: Chipped | C10: Good | D10: Eccentric | E10: Broken | F10: Inner | G10: Ball | H10: Outer | I10: Good | J10: Good | K10: Good | L10: Good | M10: Good
A11: Spur 6 | B11: Good | C11: Good | D11: Good | E11: Broken | F11: Inner | G11: Ball | H11: Outer | I11: Good | J11: Good | K11: Good | L11: Imbalance | M11: Good
A12: Spur 7 | B12: Good | C12: Good | D12: Good | E12: Good | F12: Inner | G12: Good | H12: Good | I12: Good | J12: Good | K12: Good | L12: Good | M12: Keyway Sheared
A13: Spur 8 | B13: Good | C13: Good | D13: Good | E13: Good | F13: Good | G13: Ball | H13: Outer | I13: Good | J13: Good | K13: Good | L13: Imbalance | M13: Good
A16: Case | B16: 16T | C16: 48T | D16: 24T | E16: 40T | F16: IS:IS | G16: ID:IS | H16: OS:IS | I16: IS:OS | J16: ID:OS | K16: OS:OS | L16: Input | M16: Output
A17: Helical 1 | B17: Good | C17: Good | D17: Good | E17: Good | F17: Good | G17: Good | H17: Good | I17: Good | J17: Good | K17: Good | L17: Good | M17: Good
A18: Helical 2 | B18: Good | C18: Good | D18: Chipped | E18: Good | F18: Good | G18: Good | H18: Good | I18: Good | J18: Good | K18: Good | L18: Good | M18: Good
A19: Helical 3 | B19: Good | C19: Good | D19: Broken | E19: Good | F19: Good | G19: Good | H19: Good | I19: Combination | J19: Inner | K19: Good | L19: Bent Shaft | M19: Good
A20: Helical 4 | B20: Good | C20: Good | D20: Good | E20: Good | F20: Good | G20: Good | H20: Good | I20: Combination | J20: ball | K20: Good | L20: Imbalnce | M20: Good
A21: Helical 5 | B21: Good | C21: Good | D21: Broken | E21: Good | F21: Good | G21: Good | H21: Good | I21: Good | J21: Inner | K21: Good | L21: Good | M21: Good
A22: Helical 6 | B22: Good | C22: Good | D22: Good | E22: Good | F22: Good | G22: Good | H22: Good | I22: Good | J22: Good | K22: Good | L22: Bent Shaft | M22: Good
A27: Bearing Data
A28: Bearing | B28: MB Manufacturing | D28: ER-10K
A29: # Elements | B29: 8
A30: R.E. Diameter | B30: 0.3125
A31: Pitch Dia. | B31: 1.319
A32: Contact Angle | B32: 0
A34: Each Acquisition | B34: 4 Seconds
A35: 2 acquisitions per Operating Speed and Load
A37: Operating Speeds (Hz) | B37: 30 | C37: 35 | D37: 40 | E37: 45 | F37: 50
A38: RPM | B38: =B37*60 -> 1800 | C38: =C37*60 -> 2100 | D38: =D37*60 -> 2400 | E38: =E37*60 -> 2700 | F38: =F37*60 -> 3000
A39: Load: | B39: Low | C39: High
A40: Total Runs: | B40: =2*5*14 -> 140
A41: Sample Rate | B41: 66.6667 KHz
A44: Accelerometers: | B44: Endevco | C44: 6259M31 | D44: 10mv/g